{"evidenceId":"sha256:d5582e0955b4e45ee669ed0abf48f79ebb1831f1b0ae94064100a24dcc9a6b88","id":"sha256:cfb152ba5300fb6877ce97b3e274aa2caf50472079f595adf60e0005ffa3d55f","manifestDigest":"sha256:7beb8479a0d4935157bda79b421e0e623980886da6eae6d4cf3def86aebad5b1","resolver":{"id":"diffra.dogfood.resolver","resolvedCommit":"0000000000000000000000000000000000000000","sourceRef":"main","version":"1.0"},"role":"merge-base","schema":"https://diffra.dev/schemas/baseline-reference-v1.schema.json","sourceStore":"local","status":"trusted","subjectCommit":"0000000000000000000000000000000000000000","trust":{"decisionId":"initial-baseline","issuer":"trusted-ci"}}